<?xml version="1.0" encoding="utf-8" ?>
<?meta name="GENERATOR" content="XML::Smart/1.6.9 Perl/5.014002 [linux]" ?>
<tool xmlns:xsi="http://www.w3.org/2001/XMLSchema-instance" xsi:schemaLocation="http://scape-project.eu/tool tool-1.0_draft.xsd" xmlns="http://scape-project.eu/tool" xmlns:xlink="http://www.w3.org/1999/xlink" schemaVersion="1.0" name="FFmpeg" version="1.0" homepage="http://ffmpeg.org/">
  <installation>
    <dependency operatingSystemName="Debian">ffmpeg</dependency>
    <license type="Apache Licence 2.0">Apache License, Version 2.0</license>
  </installation>
  <otherProperties>
    <property name="cost">0</property>
  </otherProperties>
  <operations>
    <operation name="digital-preservation-migration-video-ffmpeg-image2tiff">
      <description>Converts any FFmpeg supported image format to TIFF</description>
      <command>ffmpeg -y -i ${input} ${output}</command>
      <inputs>
        <input name="input" required="true">
          <description>Reference to input file</description>
        </input>
        <parameter name="params" required="false">
          <description>Additional conversion parameters</description>
        </parameter>
      </inputs>
      <outputs>
        <output name="output" required="true">
          <description>Reference to output file</description>
          <extension>tiff</extension>
        </output>
      </outputs>
    </operation>
  </operations>
</tool>

